titre,annee,genre,realisateur,synopsis
Inception,2010,Science-fiction,Christopher Nolan,Un voleur pénètre dans les rêves pour voler des secrets.
The Matrix,1999,Action,Lana Wachowski|Lilly Wachowski,Un hacker découvre une réalité virtuelle contrôlée par des machines.
Interstellar,2014,Science-fiction,Christopher Nolan,Un groupe d'astronautes part à la recherche d'une nouvelle planète habitable.
Parasite,2019,Drame,Bong Joon-ho,Une famille pauvre infiltre la maison d'une famille riche en se faisant passer pour des experts.
The Godfather,1972,Drame,Francis Ford Coppola,L'histoire de la famille mafieuse Corleone dans l'Amérique des années 1940.
